user_input,retrieved_contexts,reference_contexts,response,reference,context_recall,llm_context_precision_with_reference,faithfulness,answer_relevancy,answer_correctness
"2025년 기준, 의료급여 1종 수급권자의 의원급 외래 본인부담금은 얼마인가요?","['산정되는 수가와 본인부담금은 어떻게 되나요?\nA 의료급여기관에 소속된 계약의사가 시설 내에서 진료 후 사회복지시설 입소자에게 원외처방전을\n발행하거나 원내 직접조제·투약한 경우 건강보험과 동일한 수가를 산정하며, 본인일부부담금은 1·2종\n수급권자를 불문하고 1,000원~1,500원을 부담합니다. 단, 1종수급권자 중 외래본인부담면제자의 경우\n본인부담금을 면제합니다.\n※관련근거 : 「의료급여수가의 기준 및 일반기준」제17조의5\nQ48\n의료급여 선별급여 본인부담은 건강보험 선별급여 본인부담과 다른가요?\nA 건강보험과 동일한 30~90% 본인부담률을 적용받습니다.\n※관련근거 : 「의료급여수가의 기준 및 일반기준」제23조의2\n30•2025 알기 쉬운 의료급여제도 Ⅱ. 자주하는 질문 •31', '위탁한 상급종합병원 또는 종합병원의 의사가\n적용제외\n해당 법률에서 정한 의료지원대상자에게 발행한\n대상\n처방전에 따라 의약품을 조제 받은 경우\n• 의료급여 본인부담 면제자\n• 종 합병원급 이상 기관을 선택의료급여\n기관으로 지정하고 해당 병원에서\n처방받는 경우\nQ56\n의료급여수급권자의 경우 경증질환으로 상급종합병원과 종합병원 외래진료\n시 약국 약값 외에 병원 진료비에 대한 본인부담금도 달라지나요?\nA 상급종합병원과 종합병원 외래 진료 시 본인부담금은 현행과 같이 1종은 1,500~2,000원, 2종은 총\n진료비의 15%로 경증질환 약국 약값과는 다릅니다.\n34•2025 알기 쉬운 의료급여제도 Ⅱ. 자주하는 질문 •', '03 의료급여 본인일부부담금\n1\n의료급여기관 이용 시 본인부담률 및 부담액\n1차 2차 3차\n구분 약국 CT, MRI, PET 등\n(의원) (병원, 종합병원) (상급종합병원)\n입원 무 료 - 무 료\n1종\n외래 1,000원 1,500원 2,000원 500원 5%\n입원 10% 10% 10% - 10%\n2종\n외래 1,000원 15% 15% 500원 15%\n※ 경증질환 약국 약제비 본인부담률 3% 적용\n※ 비급여는 전액본인부담, 선별급여는 항목별로 30~90% 본인부담\n※ 요양병원 입원환자가 의료급여의뢰서 없이 다른 의료기관 이용 시 진료비 전액 본인부담\n※ 연장승인(선택의료급여기관) 미신청자(불승인자) 본인부담률 입원 20%, 외래 및 약국 30%\n2\n본인부담금 면제자\n구분 대 상 자\n• 18세 미만인 자\n• 20세 미만인 자로 중고등학교 재학 중인 자\n• 임산부\n• 가정간호대상자\n• 선택의료급여기관 이용자']","['1종 외래 1,000원']","2025년 기준, 의료급여 1종 수급권자의 의원급 외래 본인부담금은 1,000원입니다.","2025년 기준 의료급여 1종 수급권자의 1차 의료급여기관(의원) 외래 본인부담금은 1,000원입니다.",1.0,0.8333333332916666,1.0,0.5161601937915251,0.9761247231679839
"2026년 기준, 의료급여 1종 수급권자의 의원급 외래 본인부담금은 얼마인가요?","['산정되는 수가와 본인부담금은 어떻게 되나요?\nA 의료급여기관에 소속된 계약의사가 시설 내에서 진료 후 사회복지시설 입소자에게 원외처방전을\n발행하거나 원내 직접조제·투약한 경우 건강보험과 동일한 수가를 산정하며, 본인일부부담금은 1·2\n종 수급권자를 불문하고 1,000원~1,500원을 부담합니다. 단, 1종수급권자 중 외래본인부담면제자의\n경우 본인부담금을 면제합니다.\n※관련근거: 「의료급여수가의 기준 및 일반기준」제17조의5\nQ47\n의료급여 선별급여 본인부담은 건강보험 선별급여 본인부담과 다른가요?\nA 건강보험과 동일한 30~90% 본인부담률을 적용받습니다.\n※관련근거: 「의료급여수가의 기준 및 일반기준」제23조의2\n30•2026 알기 쉬운 의료급여제도', '03 의료급여 본인일부부담금\n1\n의료급여기관 이용 시 본인부담률 및 부담액\n1차 2차 3차\n구분 약국 CT, MRI, PET 등\n(의원) (병원, 종합병원) (상급종합병원)\n입원 무 료 - 무 료\n1종\n외래 1,000원 1,500원 2,000원 500원 5%\n입원 10% 10% 10% - 10%\n2종\n외래 1,000원 15% 15% 500원 15%\n※ 경증질환 약국 약제비 본인부담률 3% 적용\n※ 비급여는 전액본인부담, 선별급여는 항목별로 30~90% 본인부담\n※ 요양병원 입원환자가 의료급여의뢰서 없이 다른 의료급여기관 이용 시 진료비 전액 본인부담\n※ 연장승인(선택의료급여기관) 미신청자(불승인자) 본인부담률 입원 20%, 외래 및 약국 30%\n2\n본인부담금 면제자\n구분 대 상 자\n•18세 미만인 자\n•20세 미만인 자로 중고등학교 재학 중인 자\n•임산부\n•가정간호대상자\n•선택의료급여기관 이용자', '4 의료급여 외래진료 적정관리를 위한 365회 초과 시 본인부담률 30% 적용\n(’26. 1. 1. 시행)\n○ 연 간 외래 의료급여 받은 횟수 180회, 240회, 300회 초과 및 365회 초과 시 본인부담률 30% 적용 알림\n※ 관련근거: 「 의료급여법 시행규칙」 [별표1의2], 「의료급여 외래진료 본인부담차등 기준 등에 관한 고시」 고시\n제2025-248호\n5\n의료급여 초과 본인부담금 환급 산정기간 변경(’26. 1. 1. 시행)\n○ 본 인부담금 일정 금액 초과 시 초과 금액 환급하는 산정기간을 30일→월단위 변경\n※ 관련근거: 「의료급여법 시행령」 제13조제5항\n6\n의료급여 조산아 지원 기간 확대(’26. 1. 1. 시행)\n○ 조 산아 맞춤형 의료급여 지원을 위해 출생일로부터 5년→5년 4개월 기간 확대\n※ 관련근거: 「의료급여법 시행령」 [별표1]\n7\n의료급여 특수식 식대 건강보험 의원급과 동일하게 인상(’26. 1. 1. 시행)']","['1종 외래 1,000원']","2026년 기준, 의료급여 1종 수급권자의 의원급 외래 본인부담금은 1,000원입니다.","2026년 기준 의료급여 1종 수급권자의 1차 의료급여기관(의원) 외래 본인부담금은 1,000원입니다.",1.0,0.99999999995,1.0,0.5166522880265473,0.7269874635324978
"2025년 기준, 정신질환 외래진료 시 장기지속형 주사제의 본인부담률은 몇 %인가요?","['○ 정신질환 외래진료\n구분 본인부담률\n조현병 병원급 이상 5%\n조현병 외 정신질환 병원급 이상 10%\n장기지속형 주사제*\n5%\n*1·2종 모두 해당, 외래본인부담면제자 제외\n○ 치매질환 입원 및 병원급 이상 외래진료 : 5%\n○ 만성질환자(보건복지부 고시)의 병원급 외래진료 : 1,000원\n○ 가정간호 대상자 : 10%\n○ CT, MRI, PET 등\n구분 본인부담률\n임신부(유산·사산 포함) 제1차의료급여기관\n5세까지의 조산아 및 저체중 출생아 제1차의료급여기관\n5%\n치매 질환자 제1차의료급여기관\n1세 미만 만성질환자 제2차의료급여기관\n조현병 등 정신질환자 제2·3차의료급여기관 15%\n12•2025 알기 쉬운 의료급여제도 Ⅰ. 의료급여제도 •', '3\n잠복결핵 치료 관련 진료 본인부담률\n○ 잠 복결핵 치료 관련 입원 및 외래진료 : 본인부담 면제\n4\n인체면역결핍바이러스질환자 관련 진료 본인부담률\n○ 인 체면역결핍바이러스질환자의 해당상병 입원 및 외래진료 : 본인부담 면제\n5\n입원 식대 본인부담률\n구분 본인부담률\n1종·2종\n20%\n2종장애인\n중증질환(합병증 포함) 5%\n행려환자, 자연분만, 6세 미만 아동 무 료\n6\n2, 3인실 입원료 본인부담률\n구분 2인실 3인실\n상급종합병원 50% 40%\n종합병원·한방병원·정신병원·병원(치과·요양병원* 제외)\n40% 30%\n*의료재활시설은 포함(’19.11.1.부터)\n※ 본인부담 보상제·상한제 해당되지 않음, 2종장애인의 경우 장애인의료비 지원 없음\n7\n65세 이상 등록된 틀니 및 치과 임플란트 본인부담률\n구분 틀니 임플란트\n1종 5% 10%\n2종 15% 20%\n※ 본인부담 보상제·상한제 해당되지 않음, 2종장애인의 경우 장애인의료비 지원 없음', '03 의료급여 본인일부부담금\n1\n의료급여기관 이용 시 본인부담률 및 부담액\n1차 2차 3차\n구분 약국 CT, MRI, PET 등\n(의원) (병원, 종합병원) (상급종합병원)\n입원 무 료 - 무 료\n1종\n외래 1,000원 1,500원 2,000원 500원 5%\n입원 10% 10% 10% - 10%\n2종\n외래 1,000원 15% 15% 500원 15%\n※ 경증질환 약국 약제비 본인부담률 3% 적용\n※ 비급여는 전액본인부담, 선별급여는 항목별로 30~90% 본인부담\n※ 요양병원 입원환자가 의료급여의뢰서 없이 다른 의료기관 이용 시 진료비 전액 본인부담\n※ 연장승인(선택의료급여기관) 미신청자(불승인자) 본인부담률 입원 20%, 외래 및 약국 30%\n2\n본인부담금 면제자\n구분 대 상 자\n• 18세 미만인 자\n• 20세 미만인 자로 중고등학교 재학 중인 자\n• 임산부\n• 가정간호대상자\n• 선택의료급여기관 이용자']","['장기지속형 주사제* *1·2종 모두 해당, 외래본인부담면제자 제외 5%']",5%입니다.,2025년 기준 정신질환 외래진료 시 장기지속형 주사제의 본인부담률은 5%입니다.,1.0,0.8333333332916666,0.0,0.3597574938815577,0.8413984787710909
"2026년 기준, 정신질환 외래진료 시 장기지속형 주사제의 본인부담률은 몇 %인가요?","['’25. 10. 1.\n○ 정신질환 외래 진료 시, 항정신병 장기지속형주사제 본인부담률 5→2% 완화\n※ 관련근거: 「의료급여법 시행령」 [별표1]\n○ 정신과 외래 정신요법료 급여기준 건강보험과 동일하게 산정하도록 급여기준 완화\n○ 정신과 입원 정액수가 병·의원 수가 종별 역전현상 해소\n’26. 1. 1. ○ 정신과 폐쇄병동 입원 시 정액수가 12→16% 가산 인상\n○ 급성기 정신질환 집중치료실 입원 시 별도 정액수가 신설(’25. 12. 29. 시행)\n※ 관련근거: 「의료급여수가의 기준 및 일반기준」 고시 제2025-225호\n12•2026 알기 쉬운 의료급여제도', '○ 노 숙인 의료접근성을 지속 제고하기 위해 전체 제1·2차의료급여기관을 노숙인진료시설(요양병원\n제외)로 지정 확대\n유효기간 3년 연장(유효기간: ’25. 3. 22.~ ’28. 3. 21.)\n※ 관련근거 :「노숙인진료시설 지정 등에 관한 고시」 고시 제2025-46호\n3\n의료급여 정신과 수가 개선(‘25. 7. 1., 10. 1., ’26. 1. 1. 시행)\n시행일 개정 내역\n○ 정신과 폐쇄병동 입원 시 정액수가 12% 가산 적용\n’25. 7. 1. ○ 정신과 입원 정액수가 외 격리보호료 별도 산정 신설\n※ 관련근거: 「의료급여수가의 기준 및 일반기준」 고시 제2025-103호\n○ 격리보호료를 정신안정실 관리료로 명칭 변경\n※ 관련근거: 「의료급여수가의 기준 및 일반기준」 고시 제2025-171호\n’25. 10. 1.\n○ 정신질환 외래 진료 시, 항정신병 장기지속형주사제 본인부담률 5→2% 완화\n※ 관련근거: 「의료급여법 시행령」 [별표1]', '○ 정신질환 외래진료\n구분 본인부담률\n조현병 병원급 이상 5%\n조현병 외 정신질환 병원급 이상 10%\n장기지속형 주사제*\n2%\n*1·2종 모두 해당, 외래본인부담면제자 제외\n○ 치매질환 입원 및 병원급 이상 외래진료 : 5%\n○ 만성질환자(보건복지부 고시)의 병원급 외래진료 : 1,000원\n○ 가정간호 대상자 : 10%\n○ CT, MRI, PET 등\n구분 본인부담률\n임신부(유산·사산 포함) 제1차의료급여기관\n5세까지의 조산아·저체중 출생아 제1차의료급여기관\n5%\n치매 질환자 제1차의료급여기관\n1세 미만 만성질환자 제2차의료급여기관\n조현병 등 정신질환자 제2·3차의료급여기관 15%\nⅠ. 의료급여제도 •11']","['○ 정신질환 외래 진료 시, 항정신병 장기지속형주사제 본인부담률 5→2% 완화']","2026년 기준, 정신질환 외래진료 시 장기지속형 주사제의 본인부담률은 2%입니다.",2026년 기준 정신질환 외래진료 시 장기지속형 주사제의 본인부담률은 2%입니다.,1.0,0.9999999999666667,1.0,0.4187365108063022,0.9925608091453036
"2026년부터 적용되는 규정에 따라, 연간 외래 진료 횟수가 365회를 초과할 경우 본인부담률은 어떻게 되나요?","['4 의료급여 외래진료 적정관리를 위한 365회 초과 시 본인부담률 30% 적용\n(’26. 1. 1. 시행)\n○ 연 간 외래 의료급여 받은 횟수 180회, 240회, 300회 초과 및 365회 초과 시 본인부담률 30% 적용 알림\n※ 관련근거: 「 의료급여법 시행규칙」 [별표1의2], 「의료급여 외래진료 본인부담차등 기준 등에 관한 고시」 고시\n제2025-248호\n5\n의료급여 초과 본인부담금 환급 산정기간 변경(’26. 1. 1. 시행)\n○ 본 인부담금 일정 금액 초과 시 초과 금액 환급하는 산정기간을 30일→월단위 변경\n※ 관련근거: 「의료급여법 시행령」 제13조제5항\n6\n의료급여 조산아 지원 기간 확대(’26. 1. 1. 시행)\n○ 조 산아 맞춤형 의료급여 지원을 위해 출생일로부터 5년→5년 4개월 기간 확대\n※ 관련근거: 「의료급여법 시행령」 [별표1]\n7\n의료급여 특수식 식대 건강보험 의원급과 동일하게 인상(’26. 1. 1. 시행)', '’25. 10. 1.\n○ 정신질환 외래 진료 시, 항정신병 장기지속형주사제 본인부담률 5→2% 완화\n※ 관련근거: 「의료급여법 시행령」 [별표1]\n○ 정신과 외래 정신요법료 급여기준 건강보험과 동일하게 산정하도록 급여기준 완화\n○ 정신과 입원 정액수가 병·의원 수가 종별 역전현상 해소\n’26. 1. 1. ○ 정신과 폐쇄병동 입원 시 정액수가 12→16% 가산 인상\n○ 급성기 정신질환 집중치료실 입원 시 별도 정액수가 신설(’25. 12. 29. 시행)\n※ 관련근거: 「의료급여수가의 기준 및 일반기준」 고시 제2025-225호\n12•2026 알기 쉬운 의료급여제도', '산정되는 수가와 본인부담금은 어떻게 되나요?\nA 의료급여기관에 소속된 계약의사가 시설 내에서 진료 후 사회복지시설 입소자에게 원외처방전을\n발행하거나 원내 직접조제·투약한 경우 건강보험과 동일한 수가를 산정하며, 본인일부부담금은 1·2\n종 수급권자를 불문하고 1,000원~1,500원을 부담합니다. 단, 1종수급권자 중 외래본인부담면제자의\n경우 본인부담금을 면제합니다.\n※관련근거: 「의료급여수가의 기준 및 일반기준」제17조의5\nQ47\n의료급여 선별급여 본인부담은 건강보험 선별급여 본인부담과 다른가요?\nA 건강보험과 동일한 30~90% 본인부담률을 적용받습니다.\n※관련근거: 「의료급여수가의 기준 및 일반기준」제23조의2\n30•2026 알기 쉬운 의료급여제도']","[""4 의료급여 외래진료 적정관리를 위한 365회 초과 시 본인부담률 30% 적용 ('26. 1. 1. 시행)"", '○ 연간 외래 의료급여 받은 횟수 180회, 240회, 300회 초과 및 365회 초과 시 본인부담률 30% 적용 알림']","2026년부터 적용되는 규정에 따라, 연간 외래 진료 횟수가 365회를 초과할 경우 본인부담률은 30%입니다.",2026년부터 연간 외래 의료급여를 받은 횟수가 365회를 초과할 경우 본인부담률 30%가 적용됩니다.,1.0,0.8333333332916666,1.0,0.4533592272933857,0.7015034312463916
"2025년 기준, 조산아 및 저체중 출생아가 병원급 이상 외래진료 시 본인부담률은 몇 %인가요?","['○ 정신질환 외래진료\n구분 본인부담률\n조현병 병원급 이상 5%\n조현병 외 정신질환 병원급 이상 10%\n장기지속형 주사제*\n5%\n*1·2종 모두 해당, 외래본인부담면제자 제외\n○ 치매질환 입원 및 병원급 이상 외래진료 : 5%\n○ 만성질환자(보건복지부 고시)의 병원급 외래진료 : 1,000원\n○ 가정간호 대상자 : 10%\n○ CT, MRI, PET 등\n구분 본인부담률\n임신부(유산·사산 포함) 제1차의료급여기관\n5세까지의 조산아 및 저체중 출생아 제1차의료급여기관\n5%\n치매 질환자 제1차의료급여기관\n1세 미만 만성질환자 제2차의료급여기관\n조현병 등 정신질환자 제2·3차의료급여기관 15%\n12•2025 알기 쉬운 의료급여제도 Ⅰ. 의료급여제도 •', '8\n추나요법 본인부담률\n복잡추나 단순추나, 특수추나\n구분\n1종 2종 1종 2종\n디스크, 협착증 30% 40%\n30% 40%\n디스크, 협착증 외 80% 80%\n9\n의료급여 2종수급권자 본인부담률\n○ 치 아 홈메우기\n구분 본인부담률\n6세 미만 무료\n입원 6세 이상 ~ 15세 이하 3%\n16세 이상 ~ 18세 이하 5%\n외래 18세 이하 병원급 이상 5%\n○ 분만 및 임신부\n구분 본인부담률\n자연분만 무료\n입원 제왕절개분만 무료\n고위험 임신부 5%\n외래 임신부(유산·사산 포함) 병원급 이상 5%\n○ 1 5세 이하 아동\n구분 본인부담률\n6세 미만 무료\n입원\n6세 이상 ~ 15세 이하 3%\n제1차의료급여기관 무료\n1세 미만\n제2·3차의료급여기관 5%\n외래\n1세 미만 만성질환자 제2차의료급여기관 무료\n5세까지의 조산아·저체중출생아 병원급 이상 5%\n10•2025 알기 쉬운 의료급여제도 Ⅰ. 의료급여제도 •11', '위탁한 상급종합병원 또는 종합병원의 의사가\n적용제외\n해당 법률에서 정한 의료지원대상자에게 발행한\n대상\n처방전에 따라 의약품을 조제 받은 경우\n• 의료급여 본인부담 면제자\n• 종 합병원급 이상 기관을 선택의료급여\n기관으로 지정하고 해당 병원에서\n처방받는 경우\nQ56\n의료급여수급권자의 경우 경증질환으로 상급종합병원과 종합병원 외래진료\n시 약국 약값 외에 병원 진료비에 대한 본인부담금도 달라지나요?\nA 상급종합병원과 종합병원 외래 진료 시 본인부담금은 현행과 같이 1종은 1,500~2,000원, 2종은 총\n진료비의 15%로 경증질환 약국 약값과는 다릅니다.\n34•2025 알기 쉬운 의료급여제도 Ⅱ. 자주하는 질문 •']",['5세까지의 조산아 저체중출생아 병원급 이상 5%'],"2025년 기준, 조산아 및 저체중 출생아가 병원급 이상 외래진료 시 본인부담률은 5%입니다.",2025년 기준 5세까지의 조산아 및 저체중 출생아가 병원급 이상 의료급여기관에서 외래 진료를 받을 경우 본인부담률은 5%입니다.,1.0,0.9999999999666667,1.0,0.4684563445871304,0.7143968512560928
2026년에 확대된 조산아 및 저체중 출생아의 의료급여 지원 기간은 총 얼마인가요?,"['4 의료급여 외래진료 적정관리를 위한 365회 초과 시 본인부담률 30% 적용\n(’26. 1. 1. 시행)\n○ 연 간 외래 의료급여 받은 횟수 180회, 240회, 300회 초과 및 365회 초과 시 본인부담률 30% 적용 알림\n※ 관련근거: 「 의료급여법 시행규칙」 [별표1의2], 「의료급여 외래진료 본인부담차등 기준 등에 관한 고시」 고시\n제2025-248호\n5\n의료급여 초과 본인부담금 환급 산정기간 변경(’26. 1. 1. 시행)\n○ 본 인부담금 일정 금액 초과 시 초과 금액 환급하는 산정기간을 30일→월단위 변경\n※ 관련근거: 「의료급여법 시행령」 제13조제5항\n6\n의료급여 조산아 지원 기간 확대(’26. 1. 1. 시행)\n○ 조 산아 맞춤형 의료급여 지원을 위해 출생일로부터 5년→5년 4개월 기간 확대\n※ 관련근거: 「의료급여법 시행령」 [별표1]\n7\n의료급여 특수식 식대 건강보험 의원급과 동일하게 인상(’26. 1. 1. 시행)', '8\n추나요법 본인부담률\n복잡추나 단순추나, 특수추나\n구분\n1종 2종 1종 2종\n디스크, 협착증 30% 40%\n30% 40%\n디스크, 협착증 외 80% 80%\n9\n의료급여 2종수급권자 본인부담률\n○ 치 아 홈메우기\n구분 본인부담률\n6세 미만 무료\n입원 6세 이상 ~ 15세 이하 3%\n16세 이상 ~ 18세 이하 5%\n외래 18세 이하 병원급 이상 5%\n○ 분만 및 임신부\n구분 본인부담률\n자연분만 무료\n입원 제왕절개분만 무료\n고위험 임신부 5%\n외래 임신부(유산·사산 포함) 병원급 이상 5%\n○ 1 5세 이하 아동\n구분 본인부담률\n6세 미만 무료\n입원\n6세 이상 ~ 15세 이하 3%\n제1차의료급여기관 무료\n1세 미만\n제2·3차의료급여기관 5%\n외래\n1세 미만 만성질환자 제2차의료급여기관 무료\n5세까지의 조산아·저체중출생아 병원급 이상 5%\n10•2026 알기 쉬운 의료급여제도', '•외래 본인부담 면제자: 1세 미만 아동(의원급 진료)\n2종\n•중증질환자 중 뇌혈관·심장질환자(수술·약제투여·입원, 최대 30일)\n•중증외상환자(권역외상센터 입원, 최대 30일)\n※ 관련근거: 「의료급여법 시행령」제13조, [별표1], 동법 「시행규칙」제19조의4\n8 •2026 알기 쉬운 의료급여제도']","[""6 의료급여 조산아 지원 기간 확대('26. 1. 1. 시행)"", '○ 조산아 맞춤형 의료급여 지원을 위해 출생일로부터 5년 5년 4개월 기간 확대']",2026년에 확대된 조산아 및 저체중 출생아의 의료급여 지원 기간은 총 5년 4개월입니다.,2026년부터 조산아 및 저체중 출생아의 의료급여 지원 기간은 기존 출생일로부터 5년에서 5년 4개월로 확대되었습니다.,1.0,0.99999999995,1.0,0.49145079754356374,0.9683988124788692
2025년 국가건강검진 후 확진검사비 면제 대상에 포함된 정신질환 의심 증상은 무엇인가요?,"['(2025.1.1.시행)\n○ 국 가건강검진을 받은 의료급여 수급권자가 검사결과에 따라 고혈압·당뇨병·결핵 질환 확진을 위한\n경우에 우울증·조기정신증 질환을 의심하는 경우도 추가하여 외래에서 실시하는 추가 진료 및 검사를\n적용받도록 안내\n※ 관련근거 : 「건강검진기본법」, 「의료급여법 시행령」 [별표1]\n14•2025 알기 쉬운 의료급여제도 Ⅰ. 의료급여제도 •', '5 만성신부전증환자의 산정특례 적용범위 정비와 분만 공공정책수가 적용\n(2024.7.30.시행)\n○ 만 성신부전증환자 외래진료에 인공신장투석을 위한 시술·수술 관련 진료를 추가하여 적용범위 확대 및\n건강보험요양급여비용의 분만 공공정책수가를 서식 개정하여 의료급여 환자에 적용\n※ 관련근거 : 「의료급여수가의 기준 및 일반기준」제17조, [별표1]\n6\n감염병 환자에 대한 의료급여 법적 근거 마련 (2024.10.25.시행)\n○ 코로나19 치료제 급여등재에 따른 의료급여 본인부담 면제 조항 신설\n※ 관련근거 : 「의료급여법 시행령」 [별표1] 제3호 마목, 「의료급여수가의 기준 및 일반기준」 제17조의14\n7 국가건강검진 후 확진검사 우울증·조기정신증 질환 의심 시 의료급여 적용\n(2025.1.1.시행)\n○ 국 가건강검진을 받은 의료급여 수급권자가 검사결과에 따라 고혈압·당뇨병·결핵 질환 확진을 위한', 'Q17\n의료급여수급권자가 제2차의료급여기관에서 국가 암검진을 받은 결과\n이상소견이 발견되어, 해당병원(검진받은 병원)에서 진료를 받으려하는데\n제1차의료급여기관의 의료급여의뢰서가 필요한지요?\nA 제2차의료급여기관(병원)에서 국가암검진을 받은 결과 이상소견이 발견되어 진료담당 의사가\n검진결과서에 제2차의료급여기관의 진료가 필요하다고 의사소견을 기재한 경우 해당 검진결과서를\n의료급여의뢰서로 갈음할 수 있습니다. 따라서 제1차의료급여기관의 의료급여의뢰서 없이도 검진\n받은 제2차의료급여기관에서 진료가 가능합니다.\n※관련근거 : 행정해석(의급 65730-147호, ‘03.04.24.)\nQ18\n제2차의료급여기관에서 국가건강검진을 받았습니다. 검진결과 고혈압,\n당뇨병, 결핵, 우울증, 조기정신증 등 질환이 의심되어 확진검사를 받고자\n하는데 검진기관인 제2차의료급여기관에서 가능할까요?\nA 일반건강검진 결과 고혈압, 당뇨병, 결핵, 우울증, 조기정신증 등 질환이 의심되어 확진검사를']",['○ 국가건강검진을 받은 의료급여 수급권자가 검사결과에 따라 고혈압·당뇨병·결핵 질환 확진을 위한 경우에 우울증·조기정신증 질환을 의심하는 경우도 추가하여 외래에서 실시하는 추가 진료 및 검사를 적용받도록 안내'],2025년 국가건강검진 후 확진검사비 면제 대상에 포함된 정신질환 의심 증상은 우울증과 조기정신증입니다.,2025년 국가건강검진 후 확진검사비 면제 대상에 추가된 정신질환 의심 증상은 우울증과 조기정신증입니다.,1.0,0.9999999999666667,1.0,0.4745038837663209,0.9943108444852891
2026년 건강검진 후 확진검사 면제 대상에 새롭게 추가된 질환 의심 항목은 무엇인가요?,"['04 2025년 변경된 의료급여제도\n1\n국가건강검진 후 확진검사의 대상확대 등 의료급여 적용 (’25. 1. 1., ’26. 1. 1. 시행)\n○ 국 가건강검진을 받은 의료급여 수급권자가 검사결과에 따라 고혈압·당뇨병·결핵 질환 확진을 위한\n경우에 우울증·조기정신증 질환을 의심하는 경우도 추가하여 외래에서 실시하는 추가 진료 및 검사를\n본인부담 면제 적용받도록 안내(’25. 1. 1. 시행)\n○ 당 뇨병 질환 확진을 위한 경우에 검사 항목 추가, 이상지질혈증 질환을 의심하는 경우도 추가하여\n외래에서 실시하는 추가 진료 및 검사를 본인부담 면제 적용받도록 안내(’26. 1. 1. 시행)\n※ 관련근거 :「건강검진기본법」, 「의료급여법 시행령」 [별표1]\n2\n「노숙인진료시설 지정 등에 관한 고시」 일부개정(’25. 3. 22. 시행)\n○ 노 숙인 의료접근성을 지속 제고하기 위해 전체 제1·2차의료급여기관을 노숙인진료시설(요양병원\n제외)로 지정 확대', 'Q18\n제2차의료급여기관에서 국가건강검진을 받았습니다. 검진결과 고혈압,\n당뇨병, 결핵, 우울증, 조기정신증, 이상지질혈증 등 질환이 의심되어\n확진검사를 받고자 하는데 검진기관인 제2차의료급여기관에서 가능할까요?\nA 일반건강검진 결과 고혈압, 당뇨병, 결핵, 우울증, 조기정신증, 이상지질혈증 등 질환이 의심되어\n확진검사를 받고자 하는 의료급여수급권자는 제1차의료급여기관(의원급)에서 확진검사를\n받아야합니다. 다만, 「의료급여법 시행규칙」제3조에 따른 의료급여절차 예외자의 경우에는 제2차\n또는 제3차의료급여기관에서 확진검사를 받을 수 있습니다.\n※관련근거: “ 국가건강검진 후 확진검사 의료급여 적용 관련 질의응답 안내”(기초의료보장과-107호,\n’26. 1. 6.)\nQ19\n응급증상으로 병원에 갈 경우, 반드시 응급실에서 진료를 받아야만\n의료급여가 가능한가요?\nA 「응급의료에 관한 법률」제2조제1호에 해당하는 응급환자인 경우 의료급여의뢰서 없이 응급실과', '•국가건강검진을 받은 사람이 결핵질환의 확진검사를 받는 경우\n•재활의학과에서 작업치료ㆍ운동치료 등의 재활치료를 받는 경우\n•한센병환자\n제2차의료급여기관에 •등록 장애인\n의료급여 신청 가능 •섬ㆍ벽지 지역(국민건강보험법 시행령 제45조제1호) 의료급여 수급권자\n•상이등급을 받은 자\n•15세 이하의 아동이 진료 받는 경우\n6 •2026 알기 쉬운 의료급여제도']","[""○ 당뇨병 질환 확진을 위한 경우에 검사 항목 추가, 이상지질혈증 질환을 의심하는 경우도 추가하여 외래에서 실시하는 추가 진료 및 검사를 본인부담 면제 적용받도록 안내('26. 1. 1. 시행)""]",정보를 찾을 수 없습니다.,2026년 건강검진 후 확진검사 면제 대상에 새롭게 추가된 질환 의심 항목은 이상지질혈증입니다.,1.0,0.99999999995,0.0,0.0,0.03831715129510793
"2025년 기준, 노숙인 진료시설 지정의 유효기간은 언제까지로 명시되어 있나요?","['※ 관련근거 :「노숙인진료시설 지정 등에 관한 고시」 고시 제2024-40호\n○ 노 숙인 의료접근성을 지속 제고하기 위해 감염병 위기경보 발령과 상관없이 전체 제1차 및 제2차\n의료급여기관을 노숙인진료시설로 지정(유효기간: 2024.5.8.~2025.3.21.)\n※ 관련근거 : 「노숙인진료시설 지정 등에 관한 고시」 고시 제2024-80호\n3\n보철물(틀니)의 유지관리 관련 장애인 가산수가 신설 (2024.3.27.시행)\n○ 치 과처치·수술료 보철물의 유지관리 주항에 따른 장애인 가산수가(수가코드 UH664~UH674)를\n산정하는 경우 해당 가산금액은 의료급여기금에서 지원\n※ 관련근거 : 「 보철물(틀니)의 유지관리 장애인 치과 가산 수가 의료급여비용 청구방법 안내」 기초의료보장과\n-4422호\n4\n보호출산제 도입에 따른 「의료급여법 시행규칙」 일부개정 (2024.7.19.시행)\n○ 사 회적·경제적 어려움 등으로 출산·양육을 고민하는 위기임산부가 의료기관에서 가명으로 산전검진', '04 2024년 변경된 의료급여제도\n1\n비상진료 추가 지원방안 수가 지원 (2024.3.11.시행)\n○ 의 사 집단행동에 따른 진료 차질 최소화 위해 비상진료에 대한 의료급여 실시\n- 응 급 진찰료 수가 신설, 응급환자 응급의료행위[별표1] 가산 한시적 확대, 중증입원환자 비상진료 정책\n지원금, 중증환자 진료에 대한 보상, 회송료 수가 인상 등\n※ 관련근거 : 「비상진료 추가 지원방안(건강보험, 의료급여) 수가 지원」 보험급여과-1028호\n2\n「노숙인진료시설 지정 등에 관한 고시」 일부개정(2024.3.22.시행)\n○ 전체 제1차·제2차의료급여기관을 노숙인진료시설(요양병원 제외)로 지정 확대\n유효기간 1년 연장(유효기간: 2024.3.22.~2025.3.21.)\n※ 관련근거 :「노숙인진료시설 지정 등에 관한 고시」 고시 제2024-40호\n○ 노 숙인 의료접근성을 지속 제고하기 위해 감염병 위기경보 발령과 상관없이 전체 제1차 및 제2차', '2\n본인부담금 면제자\n구분 대 상 자\n• 18세 미만인 자\n• 20세 미만인 자로 중고등학교 재학 중인 자\n• 임산부\n• 가정간호대상자\n• 선택의료급여기관 이용자\n* 응 급상황 및 장애인 보조기기를 지급받으려는 경우 선택의료급여기관이 아닌 다른 의료급여기관에서\n1종 외래진료 받은 경우 본인부담금 면제\n• 행려환자\n• 노숙인 진료시설을 이용하는 노숙인\n* 의 뢰없이 발생한 응급·분만으로 노숙인 진료시설 이외의 의료급여기관을 이용하거나 노숙인 진료시설\n에서 의뢰되어 제3차의료급여기관을 이용하는 경우 본인부담금 면제\n• 보건복지부장관이 정하여 고시하는 결핵질환, 희귀난치성질환 또는 중증질환을 가진 사람\n* (구)등록 희귀난치성환자(2013.9.30. 이전 적용 수급권자) 포함\n• 입원 본인부담 면제자 : 자연분만, 제왕절개분만, 6세 미만 아동\n• 외래 본인부담 면제자 : 1세 미만 아동(의원급 진료)\n2종\n• 중증질환자 중 뇌혈관·심장질환자(수술·약제투여·입원, 최대 30일)']",['유효기간 1년 연장(유효기간: 2024.3.22.~2025.3.21.)'],"2025년 기준, 노숙인 진료시설 지정의 유효기간은 2025년 3월 21일까지로 명시되어 있습니다.",2025년 기준 노숙인 진료시설 지정의 유효기간은 2025년 3월 21일까지입니다.,1.0,0.99999999995,1.0,0.5153181542807209,0.7442394849734411
"2026년 개정판에 따르면, 노숙인 진료시설 지정 유효기간은 몇 년까지 연장되었나요?","['○ 노 숙인 의료접근성을 지속 제고하기 위해 전체 제1·2차의료급여기관을 노숙인진료시설(요양병원\n제외)로 지정 확대\n유효기간 3년 연장(유효기간: ’25. 3. 22.~ ’28. 3. 21.)\n※ 관련근거 :「노숙인진료시설 지정 등에 관한 고시」 고시 제2025-46호\n3\n의료급여 정신과 수가 개선(‘25. 7. 1., 10. 1., ’26. 1. 1. 시행)\n시행일 개정 내역\n○ 정신과 폐쇄병동 입원 시 정액수가 12% 가산 적용\n’25. 7. 1. ○ 정신과 입원 정액수가 외 격리보호료 별도 산정 신설\n※ 관련근거: 「의료급여수가의 기준 및 일반기준」 고시 제2025-103호\n○ 격리보호료를 정신안정실 관리료로 명칭 변경\n※ 관련근거: 「의료급여수가의 기준 및 일반기준」 고시 제2025-171호\n’25. 10. 1.\n○ 정신질환 외래 진료 시, 항정신병 장기지속형주사제 본인부담률 5→2% 완화\n※ 관련근거: 「의료급여법 시행령」 [별표1]', '04 2025년 변경된 의료급여제도\n1\n국가건강검진 후 확진검사의 대상확대 등 의료급여 적용 (’25. 1. 1., ’26. 1. 1. 시행)\n○ 국 가건강검진을 받은 의료급여 수급권자가 검사결과에 따라 고혈압·당뇨병·결핵 질환 확진을 위한\n경우에 우울증·조기정신증 질환을 의심하는 경우도 추가하여 외래에서 실시하는 추가 진료 및 검사를\n본인부담 면제 적용받도록 안내(’25. 1. 1. 시행)\n○ 당 뇨병 질환 확진을 위한 경우에 검사 항목 추가, 이상지질혈증 질환을 의심하는 경우도 추가하여\n외래에서 실시하는 추가 진료 및 검사를 본인부담 면제 적용받도록 안내(’26. 1. 1. 시행)\n※ 관련근거 :「건강검진기본법」, 「의료급여법 시행령」 [별표1]\n2\n「노숙인진료시설 지정 등에 관한 고시」 일부개정(’25. 3. 22. 시행)\n○ 노 숙인 의료접근성을 지속 제고하기 위해 전체 제1·2차의료급여기관을 노숙인진료시설(요양병원\n제외)로 지정 확대', '2\n본인부담금 면제자\n구분 대 상 자\n•18세 미만인 자\n•20세 미만인 자로 중고등학교 재학 중인 자\n•임산부\n•가정간호대상자\n•선택의료급여기관 이용자\n* 응 급상황 및 장애인 보조기기를 지급받으려는 경우 선택의료급여기관이 아닌 다른 의료급여기관에서\n1종 외래진료 받은 경우 본인부담금 면제\n•행려환자\n•노숙인 진료시설을 이용하는 노숙인\n* 의 뢰없이 발생한 응급·분만으로 노숙인 진료시설 이외의 의료급여기관을 이용하거나 노숙인 진료시설에서\n의뢰되어 제3차의료급여기관을 이용하는 경우 본인부담금 면제\n•보건복지부장관이 정하여 고시하는 결핵질환, 희귀난치성질환 또는 중증질환을 가진 사람\n* (구)등록 희귀난치성환자(’13. 9. 30. 이전 적용 수급권자) 포함\n•입원 본인부담 면제자: 자연분만, 제왕절개분만, 6세 미만 아동\n•외래 본인부담 면제자: 1세 미만 아동(의원급 진료)\n2종\n•중증질환자 중 뇌혈관·심장질환자(수술·약제투여·입원, 최대 30일)']","[""유효기간 3년 연장(유효기간: '25. 3. 22.~'28. 3. 21.)""]","2026년 개정판에 따르면, 노숙인 진료시설 지정 유효기간은 2028년 3월 21일까지 연장되었습니다.",2026년 개정판에 따르면 노숙인 진료시설 지정 유효기간은 3년 연장되어 2028년 3월 21일까지입니다.,1.0,0.9999999999,0.5,0.41278837660013457,0.613464549913783
2026년부터 경증응급환자(KTAS 4)가 응급실 이용 시 본인부담금 산정 기준이 어떻게 바뀌나요?,"['※ 관련근거: 「의료급여법 시행령」 [별표1]\n7\n의료급여 특수식 식대 건강보험 의원급과 동일하게 인상(’26. 1. 1. 시행)\n○ 치 료식, 멸균식, 분유(일반분유, 특수분유), 산모식, 경관영양유동식 인상(일반식 제외)\n※ 관련근거: 「의료급여수가의 기준 및 일반기준」 고시 제2025-225호\n8\n응급의료관리료 100분의100 본인부담 기준 변경(’26. 1. 1. 시행)\n구분 개정 전 개정 후\n「응급의료에 관한 법률」 제2조제1호\n관련법령 「한국 응급환자 중증도 분류기준」\n및 같은 법 시행규칙 [별표1]\n경증응급환자(KTAS 4)\n100분의100 대상 응급증상 환자가 아닌 경우\n·비응급환자(KTAS 5)\n※ 관련근거: 「의료급여법 시행규칙」 [별표1의2]\nⅠ. 의료급여제도 •13', '*응 급의료관리료는「한국 응급환자 중증도 분류기준」에 따른 KTAS 1~3 등급으로 진료한 경우\n의료급여가 적용되어 본인부담금이 지원\n※ 관련근거: 「응급의료에 관한 법률 시행규칙」[별표1] 및 「의료급여법 시행규칙」[별표1의2]\n16•2026 알기 쉬운 의료급여제도', '4 의료급여 외래진료 적정관리를 위한 365회 초과 시 본인부담률 30% 적용\n(’26. 1. 1. 시행)\n○ 연 간 외래 의료급여 받은 횟수 180회, 240회, 300회 초과 및 365회 초과 시 본인부담률 30% 적용 알림\n※ 관련근거: 「 의료급여법 시행규칙」 [별표1의2], 「의료급여 외래진료 본인부담차등 기준 등에 관한 고시」 고시\n제2025-248호\n5\n의료급여 초과 본인부담금 환급 산정기간 변경(’26. 1. 1. 시행)\n○ 본 인부담금 일정 금액 초과 시 초과 금액 환급하는 산정기간을 30일→월단위 변경\n※ 관련근거: 「의료급여법 시행령」 제13조제5항\n6\n의료급여 조산아 지원 기간 확대(’26. 1. 1. 시행)\n○ 조 산아 맞춤형 의료급여 지원을 위해 출생일로부터 5년→5년 4개월 기간 확대\n※ 관련근거: 「의료급여법 시행령」 [별표1]\n7\n의료급여 특수식 식대 건강보험 의원급과 동일하게 인상(’26. 1. 1. 시행)']","[""8 응급의료관리료 100분의100 본인부담 기준 변경('26. 1. 1. 시행)"", '개정 후 경증응급환자(KTAS 4) ·비응급환자(KTAS 5)']",2026년부터 경증응급환자(KTAS 4)가 응급실 이용 시 본인부담금 산정 기준이 100% 본인부담으로 변경됩니다. 이는 응급증상 환자가 아닌 경우에 해당합니다.,2026년부터 경증응급환자(KTAS 4) 및 비응급환자(KTAS 5)가 응급실 이용 시 응급의료관리료 100분의 100 본인부담 대상으로 변경됩니다.,1.0,0.9999999999666667,1.0,0.36396886304489057,0.5091979597148086
2025년 대비 2026년에 정신질환 장기지속형 주사제의 본인부담률은 얼마나 인하되었나요?,"['’25. 10. 1.\n○ 정신질환 외래 진료 시, 항정신병 장기지속형주사제 본인부담률 5→2% 완화\n※ 관련근거: 「의료급여법 시행령」 [별표1]\n○ 정신과 외래 정신요법료 급여기준 건강보험과 동일하게 산정하도록 급여기준 완화\n○ 정신과 입원 정액수가 병·의원 수가 종별 역전현상 해소\n’26. 1. 1. ○ 정신과 폐쇄병동 입원 시 정액수가 12→16% 가산 인상\n○ 급성기 정신질환 집중치료실 입원 시 별도 정액수가 신설(’25. 12. 29. 시행)\n※ 관련근거: 「의료급여수가의 기준 및 일반기준」 고시 제2025-225호\n12•2026 알기 쉬운 의료급여제도', '○ 노 숙인 의료접근성을 지속 제고하기 위해 전체 제1·2차의료급여기관을 노숙인진료시설(요양병원\n제외)로 지정 확대\n유효기간 3년 연장(유효기간: ’25. 3. 22.~ ’28. 3. 21.)\n※ 관련근거 :「노숙인진료시설 지정 등에 관한 고시」 고시 제2025-46호\n3\n의료급여 정신과 수가 개선(‘25. 7. 1., 10. 1., ’26. 1. 1. 시행)\n시행일 개정 내역\n○ 정신과 폐쇄병동 입원 시 정액수가 12% 가산 적용\n’25. 7. 1. ○ 정신과 입원 정액수가 외 격리보호료 별도 산정 신설\n※ 관련근거: 「의료급여수가의 기준 및 일반기준」 고시 제2025-103호\n○ 격리보호료를 정신안정실 관리료로 명칭 변경\n※ 관련근거: 「의료급여수가의 기준 및 일반기준」 고시 제2025-171호\n’25. 10. 1.\n○ 정신질환 외래 진료 시, 항정신병 장기지속형주사제 본인부담률 5→2% 완화\n※ 관련근거: 「의료급여법 시행령」 [별표1]', '○ 정신질환 외래진료\n구분 본인부담률\n조현병 병원급 이상 5%\n조현병 외 정신질환 병원급 이상 10%\n장기지속형 주사제*\n5%\n*1·2종 모두 해당, 외래본인부담면제자 제외\n○ 치매질환 입원 및 병원급 이상 외래진료 : 5%\n○ 만성질환자(보건복지부 고시)의 병원급 외래진료 : 1,000원\n○ 가정간호 대상자 : 10%\n○ CT, MRI, PET 등\n구분 본인부담률\n임신부(유산·사산 포함) 제1차의료급여기관\n5세까지의 조산아 및 저체중 출생아 제1차의료급여기관\n5%\n치매 질환자 제1차의료급여기관\n1세 미만 만성질환자 제2차의료급여기관\n조현병 등 정신질환자 제2·3차의료급여기관 15%\n12•2025 알기 쉬운 의료급여제도 Ⅰ. 의료급여제도 •']","['장기지속형 주사제* *1·2종 모두 해당, 외래본인부담면제자 제외 5%', '○ 정신질환 외래 진료 시, 항정신병 장기지속형주사제 본인부담률 5→2% 완화']",2025년 대비 2026년에 정신질환 장기지속형 주사제의 본인부담률은 5%에서 2%로 인하되었습니다.,정신질환 장기지속형 주사제의 본인부담률은 2025년 5%에서 2026년 2%로 총 3%p 인하되었습니다.,1.0,0.9999999999666667,0.0,0.37599287542403714,0.7117364876000388
2025년과 2026년의 의료급여 본인부담금 환급 산정기간의 차이는 무엇인가요?,"['4 의료급여 외래진료 적정관리를 위한 365회 초과 시 본인부담률 30% 적용\n(’26. 1. 1. 시행)\n○ 연 간 외래 의료급여 받은 횟수 180회, 240회, 300회 초과 및 365회 초과 시 본인부담률 30% 적용 알림\n※ 관련근거: 「 의료급여법 시행규칙」 [별표1의2], 「의료급여 외래진료 본인부담차등 기준 등에 관한 고시」 고시\n제2025-248호\n5\n의료급여 초과 본인부담금 환급 산정기간 변경(’26. 1. 1. 시행)\n○ 본 인부담금 일정 금액 초과 시 초과 금액 환급하는 산정기간을 30일→월단위 변경\n※ 관련근거: 「의료급여법 시행령」 제13조제5항\n6\n의료급여 조산아 지원 기간 확대(’26. 1. 1. 시행)\n○ 조 산아 맞춤형 의료급여 지원을 위해 출생일로부터 5년→5년 4개월 기간 확대\n※ 관련근거: 「의료급여법 시행령」 [별표1]\n7\n의료급여 특수식 식대 건강보험 의원급과 동일하게 인상(’26. 1. 1. 시행)', '’25. 10. 1.\n○ 정신질환 외래 진료 시, 항정신병 장기지속형주사제 본인부담률 5→2% 완화\n※ 관련근거: 「의료급여법 시행령」 [별표1]\n○ 정신과 외래 정신요법료 급여기준 건강보험과 동일하게 산정하도록 급여기준 완화\n○ 정신과 입원 정액수가 병·의원 수가 종별 역전현상 해소\n’26. 1. 1. ○ 정신과 폐쇄병동 입원 시 정액수가 12→16% 가산 인상\n○ 급성기 정신질환 집중치료실 입원 시 별도 정액수가 신설(’25. 12. 29. 시행)\n※ 관련근거: 「의료급여수가의 기준 및 일반기준」 고시 제2025-225호\n12•2026 알기 쉬운 의료급여제도', '04 2025년 변경된 의료급여제도\n1\n국가건강검진 후 확진검사의 대상확대 등 의료급여 적용 (’25. 1. 1., ’26. 1. 1. 시행)\n○ 국 가건강검진을 받은 의료급여 수급권자가 검사결과에 따라 고혈압·당뇨병·결핵 질환 확진을 위한\n경우에 우울증·조기정신증 질환을 의심하는 경우도 추가하여 외래에서 실시하는 추가 진료 및 검사를\n본인부담 면제 적용받도록 안내(’25. 1. 1. 시행)\n○ 당 뇨병 질환 확진을 위한 경우에 검사 항목 추가, 이상지질혈증 질환을 의심하는 경우도 추가하여\n외래에서 실시하는 추가 진료 및 검사를 본인부담 면제 적용받도록 안내(’26. 1. 1. 시행)\n※ 관련근거 :「건강검진기본법」, 「의료급여법 시행령」 [별표1]\n2\n「노숙인진료시설 지정 등에 관한 고시」 일부개정(’25. 3. 22. 시행)\n○ 노 숙인 의료접근성을 지속 제고하기 위해 전체 제1·2차의료급여기관을 노숙인진료시설(요양병원\n제외)로 지정 확대']","[""5 의료급여 초과 본인부담금 환급 산정기간 변경('26. 1. 1. 시행)"", '○ 본인부담금 일정 금액 초과 시 초과 금액 환급하는 산정기간을 30일 월단위 변경']","2025년에는 본인부담금 일정 금액 초과 시 초과 금액 환급 산정기간이 30일이었으나, 2026년에는 이 산정기간이 월단위로 변경되었습니다.","의료급여 초과 본인부담금 환급 산정기간이 2025년에는 30일이었으나, 2026년부터는 월단위로 변경되었습니다.",1.0,0.9999999999666667,0.5,0.5861536285782406,0.9628939162854337
2025년 2종 수급권자 아동의 입원 식대 본인부담률은?,"['진료한 경우에는 식대 금액의 5%이며 행려환자, 자연분만 및 6세미만의 아동의 입원진료의 경우에는\n식대 본인부담금을 면제합니다.\n※관련근거 : 「의료급여법 시행규칙」[별표1의2], 「의료급여수가의 기준 및 일반기준」제23조\nQ52\n의료급여 2종수급권자 중 15세 이하 아동이 입원한 경우, 본인부담 적용은\n어떻게 되나요?\nA 6세 미만의 아동은 식대를 포함한 입원 진료비가 면제 적용됩니다.\n6세 이상 15세 이하 아동인 경우는 입원 본인부담률이 3%이나, 식대 본인부담률은 20%를 적용받습니다.\n※관련근거 : 「의료급여법 시행령」[별표1] 제2호\n32•2025 알기 쉬운 의료급여제도 Ⅱ. 자주하는 질문 •', 'Q49\n65세 이상 틀니 진료 시 본인부담률은 어떻게 되나요?\nA 65세 이상 수급권자가 등록된 틀니에 대한 의료급여를 입원 또는 외래에서 받은 경우 본인부담률은\n1종수급권자는 5%이며, 2종수급권자는 15%입니다.\n※관련근거 : 「의료급여법 시행령」[별표1] 제1호라목, 제2호마목\nQ50\n65세 이상 치과 임플란트 진료 시 본인부담률은 어떻게 되나요?\nA 65세 이상 수급권자가 등록된 임플란트에 대한 의료급여를 입원 또는 외래에서 받은 경우 본인부담률은\n1종수급권자는 10%, 2종수급권자는 20%입니다.\n※관련근거 : 「의료급여법 시행령」[별표1] 제1호마목, 제2호바목\nQ51\n의료급여수급권자의 입원 식대 본인부담률은 얼마인가요?\nA 식대 본인부담률은 식대 금액의 20%입니다. 다만, 중증질환자에게 해당 중증질환(합병증 포함)으로\n진료한 경우에는 식대 금액의 5%이며 행려환자, 자연분만 및 6세미만의 아동의 입원진료의 경우에는\n식대 본인부담금을 면제합니다.', '8\n추나요법 본인부담률\n복잡추나 단순추나, 특수추나\n구분\n1종 2종 1종 2종\n디스크, 협착증 30% 40%\n30% 40%\n디스크, 협착증 외 80% 80%\n9\n의료급여 2종수급권자 본인부담률\n○ 치 아 홈메우기\n구분 본인부담률\n6세 미만 무료\n입원 6세 이상 ~ 15세 이하 3%\n16세 이상 ~ 18세 이하 5%\n외래 18세 이하 병원급 이상 5%\n○ 분만 및 임신부\n구분 본인부담률\n자연분만 무료\n입원 제왕절개분만 무료\n고위험 임신부 5%\n외래 임신부(유산·사산 포함) 병원급 이상 5%\n○ 1 5세 이하 아동\n구분 본인부담률\n6세 미만 무료\n입원\n6세 이상 ~ 15세 이하 3%\n제1차의료급여기관 무료\n1세 미만\n제2·3차의료급여기관 5%\n외래\n1세 미만 만성질환자 제2차의료급여기관 무료\n5세까지의 조산아·저체중출생아 병원급 이상 5%\n10•2025 알기 쉬운 의료급여제도 Ⅰ. 의료급여제도 •11']","['Q52 의료급여 2종수급권자 중 15세 이하 아동이 입원한 경우', '6세 이상 15세 이하 아동인 경우는 입원 본인부담률이 3%이나, 식대 본인부담률은 20%를 적용받습니다.']","2025년 2종 수급권자 아동의 입원 식대 본인부담률은 6세 미만의 경우 면제되며, 6세 이상 아동의 경우 식대 본인부담률은 20%입니다.",2025년 의료급여 2종 수급권자 중 6세 이상 15세 이하 아동의 입원 식대 본인부담률은 20%입니다.,1.0,0.99999999995,1.0,0.4666759720831308,0.7071161799315175
"2026년 기준, 65세 이상 1종 수급권자의 임플란트 본인부담률은?","['Q48\n65세 이상 틀니 진료 시 본인부담률은 어떻게 되나요?\nA 65세 이상 수급권자가 등록된 틀니에 대한 의료급여를 입원 또는 외래에서 받은 경우 본인부담률은\n1종수급권자는 5%이며, 2종수급권자는 15%입니다.\n※관련근거: 「의료급여법 시행령」[별표1] 제1호라목, 제2호마목\nQ49\n65세 이상 치과 임플란트 진료 시 본인부담률은 어떻게 되나요?\nA 65세 이상 수급권자가 등록된 임플란트에 대한 의료급여를 입원 또는 외래에서 받은 경우 본인부담률은\n1종수급권자는 10%, 2종수급권자는 20%입니다.\n※관련근거: 「의료급여법 시행령」[별표1] 제1호마목, 제2호바목\nQ50\n의료급여수급권자의 입원 식대 본인부담률은 얼마인가요?\nA 식대 본인부담률은 식대 금액의 20%입니다. 다만, 중증질환자에게 해당 중증질환(합병증 포함)으로\n진료한 경우에는 식대 금액의 5%이며 행려환자, 자연분만 및 6세미만의 아동의 입원진료의 경우에는\n식대 본인부담금을 면제합니다.', '본인부담 진료비, 65세 이상 치과 틀니 및 임플란트 비용, 상급병실(2ㆍ3인실) 입원료, 추나요법 및\n연장승인 미신청 등으로 인한 본인부담금 등은 지급에서 제외 됩니다.\n32•2026 알기 쉬운 의료급여제도', '3\n잠복결핵 치료 관련 진료 본인부담률\n○ 잠 복결핵 치료 관련 입원 및 외래진료 : 본인부담 면제\n4\n인체면역결핍바이러스질환자 관련 진료 본인부담률\n○ 인 체면역결핍바이러스질환자의 해당상병 입원 및 외래진료 : 본인부담 면제\n5\n입원 식대 본인부담률\n구분 본인부담률\n1·2종\n20%\n2종장애인\n중증질환(합병증 포함) 5%\n행려환자, 자연분만, 6세 미만 아동 무 료\n6\n2, 3인실 입원료 본인부담률\n구분 2인실 3인실\n상급종합병원 50% 40%\n종합병원·한방병원·정신병원·병원(치과·요양병원* 제외)\n40% 30%\n*의료재활시설은 포함(’19.11.1.부터)\n※ 본인부담 보상제·상한제 해당되지 않음, 2종장애인의 경우 장애인의료비 지원 없음\n7\n65세 이상 등록된 틀니 및 치과 임플란트 본인부담률\n구분 틀니 임플란트\n1종 5% 10%\n2종 15% 20%\n※ 본인부담 보상제·상한제 해당되지 않음, 2종장애인의 경우 장애인의료비 지원 없음\nⅠ. 의료급여제도 • 9']","['65세 이상 수급권자가 등록된 임플란트에 대한 의료급여를 입원 또는 외래에서 받은 경우 본인부담률은 1종수급권자는 10%, 2종수급권자는 20%입니다.']","2026년 기준, 65세 이상 1종 수급권자의 임플란트 본인부담률은 10%입니다.",2026년 기준 65세 이상 의료급여 1종 수급권자의 치과 임플란트 본인부담률은 10%입니다.,1.0,0.9999999999666667,0.0,0.3920152814518527,0.9606500882441374
2025년 제2차 의료급여기관에서 외래 진료 시 2종 수급권자의 본인부담률은?,"['8\n추나요법 본인부담률\n복잡추나 단순추나, 특수추나\n구분\n1종 2종 1종 2종\n디스크, 협착증 30% 40%\n30% 40%\n디스크, 협착증 외 80% 80%\n9\n의료급여 2종수급권자 본인부담률\n○ 치 아 홈메우기\n구분 본인부담률\n6세 미만 무료\n입원 6세 이상 ~ 15세 이하 3%\n16세 이상 ~ 18세 이하 5%\n외래 18세 이하 병원급 이상 5%\n○ 분만 및 임신부\n구분 본인부담률\n자연분만 무료\n입원 제왕절개분만 무료\n고위험 임신부 5%\n외래 임신부(유산·사산 포함) 병원급 이상 5%\n○ 1 5세 이하 아동\n구분 본인부담률\n6세 미만 무료\n입원\n6세 이상 ~ 15세 이하 3%\n제1차의료급여기관 무료\n1세 미만\n제2·3차의료급여기관 5%\n외래\n1세 미만 만성질환자 제2차의료급여기관 무료\n5세까지의 조산아·저체중출생아 병원급 이상 5%\n10•2025 알기 쉬운 의료급여제도 Ⅰ. 의료급여제도 •11', '위탁한 상급종합병원 또는 종합병원의 의사가\n적용제외\n해당 법률에서 정한 의료지원대상자에게 발행한\n대상\n처방전에 따라 의약품을 조제 받은 경우\n• 의료급여 본인부담 면제자\n• 종 합병원급 이상 기관을 선택의료급여\n기관으로 지정하고 해당 병원에서\n처방받는 경우\nQ56\n의료급여수급권자의 경우 경증질환으로 상급종합병원과 종합병원 외래진료\n시 약국 약값 외에 병원 진료비에 대한 본인부담금도 달라지나요?\nA 상급종합병원과 종합병원 외래 진료 시 본인부담금은 현행과 같이 1종은 1,500~2,000원, 2종은 총\n진료비의 15%로 경증질환 약국 약값과는 다릅니다.\n34•2025 알기 쉬운 의료급여제도 Ⅱ. 자주하는 질문 •', '03 의료급여 본인일부부담금\n1\n의료급여기관 이용 시 본인부담률 및 부담액\n1차 2차 3차\n구분 약국 CT, MRI, PET 등\n(의원) (병원, 종합병원) (상급종합병원)\n입원 무 료 - 무 료\n1종\n외래 1,000원 1,500원 2,000원 500원 5%\n입원 10% 10% 10% - 10%\n2종\n외래 1,000원 15% 15% 500원 15%\n※ 경증질환 약국 약제비 본인부담률 3% 적용\n※ 비급여는 전액본인부담, 선별급여는 항목별로 30~90% 본인부담\n※ 요양병원 입원환자가 의료급여의뢰서 없이 다른 의료기관 이용 시 진료비 전액 본인부담\n※ 연장승인(선택의료급여기관) 미신청자(불승인자) 본인부담률 입원 20%, 외래 및 약국 30%\n2\n본인부담금 면제자\n구분 대 상 자\n• 18세 미만인 자\n• 20세 미만인 자로 중고등학교 재학 중인 자\n• 임산부\n• 가정간호대상자\n• 선택의료급여기관 이용자']",['2종 외래 15% 15%'],2025년 제2차 의료급여기관에서 외래 진료 시 2종 수급권자의 본인부담률은 15%입니다.,"2025년 제2차 의료급여기관(병원, 종합병원)에서 외래 진료를 받는 2종 수급권자의 본인부담률은 15%입니다.",1.0,0.5833333333041666,1.0,0.5415808518411337,0.734676339765926
2026년 의료급여 2인실 입원료 본인부담률(상급종합병원 기준)은?,"['8\n추나요법 본인부담률\n복잡추나 단순추나, 특수추나\n구분\n1종 2종 1종 2종\n디스크, 협착증 30% 40%\n30% 40%\n디스크, 협착증 외 80% 80%\n9\n의료급여 2종수급권자 본인부담률\n○ 치 아 홈메우기\n구분 본인부담률\n6세 미만 무료\n입원 6세 이상 ~ 15세 이하 3%\n16세 이상 ~ 18세 이하 5%\n외래 18세 이하 병원급 이상 5%\n○ 분만 및 임신부\n구분 본인부담률\n자연분만 무료\n입원 제왕절개분만 무료\n고위험 임신부 5%\n외래 임신부(유산·사산 포함) 병원급 이상 5%\n○ 1 5세 이하 아동\n구분 본인부담률\n6세 미만 무료\n입원\n6세 이상 ~ 15세 이하 3%\n제1차의료급여기관 무료\n1세 미만\n제2·3차의료급여기관 5%\n외래\n1세 미만 만성질환자 제2차의료급여기관 무료\n5세까지의 조산아·저체중출생아 병원급 이상 5%\n10•2026 알기 쉬운 의료급여제도', '3\n잠복결핵 치료 관련 진료 본인부담률\n○ 잠 복결핵 치료 관련 입원 및 외래진료 : 본인부담 면제\n4\n인체면역결핍바이러스질환자 관련 진료 본인부담률\n○ 인 체면역결핍바이러스질환자의 해당상병 입원 및 외래진료 : 본인부담 면제\n5\n입원 식대 본인부담률\n구분 본인부담률\n1·2종\n20%\n2종장애인\n중증질환(합병증 포함) 5%\n행려환자, 자연분만, 6세 미만 아동 무 료\n6\n2, 3인실 입원료 본인부담률\n구분 2인실 3인실\n상급종합병원 50% 40%\n종합병원·한방병원·정신병원·병원(치과·요양병원* 제외)\n40% 30%\n*의료재활시설은 포함(’19.11.1.부터)\n※ 본인부담 보상제·상한제 해당되지 않음, 2종장애인의 경우 장애인의료비 지원 없음\n7\n65세 이상 등록된 틀니 및 치과 임플란트 본인부담률\n구분 틀니 임플란트\n1종 5% 10%\n2종 15% 20%\n※ 본인부담 보상제·상한제 해당되지 않음, 2종장애인의 경우 장애인의료비 지원 없음\nⅠ. 의료급여제도 • 9', '본인부담 진료비, 65세 이상 치과 틀니 및 임플란트 비용, 상급병실(2ㆍ3인실) 입원료, 추나요법 및\n연장승인 미신청 등으로 인한 본인부담금 등은 지급에서 제외 됩니다.\n32•2026 알기 쉬운 의료급여제도']",['상급종합병원 2인실 50%'],2026년 의료급여 2인실 입원료 본인부담률(상급종합병원 기준)은 50%입니다.,2026년 기준 상급종합병원의 2인실 입원료 본인부담률은 50%입니다.,1.0,0.49999999995,0.5,0.5484574249095789,0.9774499751327225
2025년 기준 잠복결핵 치료 관련 진료의 본인부담금은?,"['3\n잠복결핵 치료 관련 진료 본인부담률\n○ 잠 복결핵 치료 관련 입원 및 외래진료 : 본인부담 면제\n4\n인체면역결핍바이러스질환자 관련 진료 본인부담률\n○ 인 체면역결핍바이러스질환자의 해당상병 입원 및 외래진료 : 본인부담 면제\n5\n입원 식대 본인부담률\n구분 본인부담률\n1종·2종\n20%\n2종장애인\n중증질환(합병증 포함) 5%\n행려환자, 자연분만, 6세 미만 아동 무 료\n6\n2, 3인실 입원료 본인부담률\n구분 2인실 3인실\n상급종합병원 50% 40%\n종합병원·한방병원·정신병원·병원(치과·요양병원* 제외)\n40% 30%\n*의료재활시설은 포함(’19.11.1.부터)\n※ 본인부담 보상제·상한제 해당되지 않음, 2종장애인의 경우 장애인의료비 지원 없음\n7\n65세 이상 등록된 틀니 및 치과 임플란트 본인부담률\n구분 틀니 임플란트\n1종 5% 10%\n2종 15% 20%\n※ 본인부담 보상제·상한제 해당되지 않음, 2종장애인의 경우 장애인의료비 지원 없음', '본인부담 진료비, 65세 이상 치과 틀니 및 임플란트 비용, 상급병실(2ㆍ3인실) 입원료, 추나요법 및\n연장승인 미신청 등으로 인한 본인부담금 등은 지급에서 제외 됩니다.\n32•2025 알기 쉬운 의료급여제도 Ⅱ. 자주하는 질문 •33', '위탁한 상급종합병원 또는 종합병원의 의사가\n적용제외\n해당 법률에서 정한 의료지원대상자에게 발행한\n대상\n처방전에 따라 의약품을 조제 받은 경우\n• 의료급여 본인부담 면제자\n• 종 합병원급 이상 기관을 선택의료급여\n기관으로 지정하고 해당 병원에서\n처방받는 경우\nQ56\n의료급여수급권자의 경우 경증질환으로 상급종합병원과 종합병원 외래진료\n시 약국 약값 외에 병원 진료비에 대한 본인부담금도 달라지나요?\nA 상급종합병원과 종합병원 외래 진료 시 본인부담금은 현행과 같이 1종은 1,500~2,000원, 2종은 총\n진료비의 15%로 경증질환 약국 약값과는 다릅니다.\n34•2025 알기 쉬운 의료급여제도 Ⅱ. 자주하는 질문 •']","['3 잠복결핵 치료 관련 진료 본인부담률', '○ 잠복결핵 치료 관련 입원 및 외래진료 : 본인부담 면제']",잠복결핵 치료 관련 진료의 본인부담금은 2025년 기준으로 본인부담 면제입니다.,2025년 기준 잠복결핵 치료 관련 입원 및 외래 진료의 본인부담금은 면제입니다.,1.0,0.9999999999,1.0,0.45867615806088874,0.6958484018078746
2025년과 2026년의 노숙인 진료시설 지정 유효기간을 각각 답하세요.,"['○ 노 숙인 의료접근성을 지속 제고하기 위해 전체 제1·2차의료급여기관을 노숙인진료시설(요양병원\n제외)로 지정 확대\n유효기간 3년 연장(유효기간: ’25. 3. 22.~ ’28. 3. 21.)\n※ 관련근거 :「노숙인진료시설 지정 등에 관한 고시」 고시 제2025-46호\n3\n의료급여 정신과 수가 개선(‘25. 7. 1., 10. 1., ’26. 1. 1. 시행)\n시행일 개정 내역\n○ 정신과 폐쇄병동 입원 시 정액수가 12% 가산 적용\n’25. 7. 1. ○ 정신과 입원 정액수가 외 격리보호료 별도 산정 신설\n※ 관련근거: 「의료급여수가의 기준 및 일반기준」 고시 제2025-103호\n○ 격리보호료를 정신안정실 관리료로 명칭 변경\n※ 관련근거: 「의료급여수가의 기준 및 일반기준」 고시 제2025-171호\n’25. 10. 1.\n○ 정신질환 외래 진료 시, 항정신병 장기지속형주사제 본인부담률 5→2% 완화\n※ 관련근거: 「의료급여법 시행령」 [별표1]', '04 2024년 변경된 의료급여제도\n1\n비상진료 추가 지원방안 수가 지원 (2024.3.11.시행)\n○ 의 사 집단행동에 따른 진료 차질 최소화 위해 비상진료에 대한 의료급여 실시\n- 응 급 진찰료 수가 신설, 응급환자 응급의료행위[별표1] 가산 한시적 확대, 중증입원환자 비상진료 정책\n지원금, 중증환자 진료에 대한 보상, 회송료 수가 인상 등\n※ 관련근거 : 「비상진료 추가 지원방안(건강보험, 의료급여) 수가 지원」 보험급여과-1028호\n2\n「노숙인진료시설 지정 등에 관한 고시」 일부개정(2024.3.22.시행)\n○ 전체 제1차·제2차의료급여기관을 노숙인진료시설(요양병원 제외)로 지정 확대\n유효기간 1년 연장(유효기간: 2024.3.22.~2025.3.21.)\n※ 관련근거 :「노숙인진료시설 지정 등에 관한 고시」 고시 제2024-40호\n○ 노 숙인 의료접근성을 지속 제고하기 위해 감염병 위기경보 발령과 상관없이 전체 제1차 및 제2차', '04 2025년 변경된 의료급여제도\n1\n국가건강검진 후 확진검사의 대상확대 등 의료급여 적용 (’25. 1. 1., ’26. 1. 1. 시행)\n○ 국 가건강검진을 받은 의료급여 수급권자가 검사결과에 따라 고혈압·당뇨병·결핵 질환 확진을 위한\n경우에 우울증·조기정신증 질환을 의심하는 경우도 추가하여 외래에서 실시하는 추가 진료 및 검사를\n본인부담 면제 적용받도록 안내(’25. 1. 1. 시행)\n○ 당 뇨병 질환 확진을 위한 경우에 검사 항목 추가, 이상지질혈증 질환을 의심하는 경우도 추가하여\n외래에서 실시하는 추가 진료 및 검사를 본인부담 면제 적용받도록 안내(’26. 1. 1. 시행)\n※ 관련근거 :「건강검진기본법」, 「의료급여법 시행령」 [별표1]\n2\n「노숙인진료시설 지정 등에 관한 고시」 일부개정(’25. 3. 22. 시행)\n○ 노 숙인 의료접근성을 지속 제고하기 위해 전체 제1·2차의료급여기관을 노숙인진료시설(요양병원\n제외)로 지정 확대']","['유효기간 1년 연장(유효기간: 2024.3.22.~2025.3.21.)', ""유효기간 3년 연장(유효기간: '25. 3. 22.~'28. 3. 21.)""]","2025년의 노숙인 진료시설 지정 유효기간은 2024년 3월 22일부터 2025년 3월 21일까지입니다.  
2026년의 노숙인 진료시설 지정 유효기간은 2025년 3월 22일부터 2028년 3월 21일까지입니다.","노숙인 진료시설 지정 유효기간은 2025년 기준 2025년 3월 21일까지이며, 2026년 기준으로는 연장되어 2028년 3월 21일까지입니다.",1.0,0.99999999995,0.5,0.48279074864969806,0.5851204578324921
